{
  "$schema": "https://json-schema.org/draft/2020-12/schema",
  "$id": "https://aria.bar/schema/aid-v1.json",
  "title": "ARIA Identity Document (AID) v1.1",
  "description": "JSON Schema for the ARIA Identity Document — a W3C Verifiable Credential (VC Data Model 2.0) that serves as a cryptographically-signed identity document for AI agents, anchored to DNS. v1.1 adds principal.verificationStatus for machine-readable identity-verification provenance, and clarifies that the top-level `id` is a unique credential-instance URL per W3C VC 2.0 §4.4 (the agent DID lives in credentialSubject.id). credentialSubject.previousCredentialId enables explicit chain-of-issuance traceability.",
  "type": "object",
  "required": [
    "@context",
    "type",
    "id",
    "issuer",
    "validFrom",
    "validUntil",
    "credentialSubject",
    "credentialStatus",
    "proof"
  ],
  "properties": {
    "@context": {
      "type": "array",
      "items": {
        "type": "string",
        "format": "uri"
      },
      "minItems": 2,
      "prefixItems": [
        { "const": "https://www.w3.org/ns/credentials/v2" },
        { "const": "https://aria.bar/ns/v1" }
      ],
      "description": "JSON-LD context. Must include the W3C VC v2 context and the ARIA v1 context."
    },
    "type": {
      "type": "array",
      "items": {
        "type": "string"
      },
      "minItems": 2,
      "contains": { "const": "VerifiableCredential" },
      "prefixItems": [
        { "const": "VerifiableCredential" },
        { "const": "ARIAIdentityDocument" }
      ],
      "description": "Credential type. Must include VerifiableCredential and ARIAIdentityDocument."
    },
    "id": {
      "type": "string",
      "format": "uri",
      "pattern": "^https://api\\.aria\\.bar/v1/credentials/[0-9a-f]{8}-[0-9a-f]{4}-7[0-9a-f]{3}-[89ab][0-9a-f]{3}-[0-9a-f]{12}$",
      "description": "Unique credential-instance identifier per W3C VC 2.0 §4.4 — a dereferenceable URL containing a UUIDv7 (RFC 9562). NOT the agent DID (the DID lives in credentialSubject.id). Each issuance produces a new id; the URL resolves to that specific signed instance, active or revoked. Equivalent to a TLS certificate serial number."
    },
    "issuer": {
      "type": "string",
      "pattern": "^did:aria:.+$",
      "description": "The DID of the issuing registry. Typically did:aria:registry.aria.bar."
    },
    "validFrom": {
      "type": "string",
      "format": "date-time",
      "description": "ISO 8601 datetime when the credential becomes valid."
    },
    "validUntil": {
      "type": "string",
      "format": "date-time",
      "description": "ISO 8601 datetime when the credential expires. Maximum 1-year validity from issuance."
    },
    "credentialStatus": {
      "type": "object",
      "required": [
        "id",
        "type",
        "statusPurpose",
        "statusListIndex",
        "statusListCredential"
      ],
      "properties": {
        "id": {
          "type": "string",
          "format": "uri",
          "description": "URI identifying the status entry. Format: <statusListCredential>#<index>."
        },
        "type": {
          "type": "string",
          "const": "BitstringStatusListEntry",
          "description": "W3C Bitstring StatusList 2021 entry type."
        },
        "statusPurpose": {
          "type": "string",
          "const": "revocation",
          "description": "Purpose of the status check. Always 'revocation' for AID documents."
        },
        "statusListIndex": {
          "type": "string",
          "pattern": "^[0-9]+$",
          "description": "Index position in the status list bitstring."
        },
        "statusListCredential": {
          "type": "string",
          "format": "uri",
          "description": "URI of the StatusList credential containing the bitstring."
        }
      },
      "additionalProperties": false,
      "description": "W3C Bitstring StatusList 2021 revocation entry."
    },
    "credentialSubject": {
      "type": "object",
      "required": [
        "id",
        "agentName",
        "version",
        "trustLevel",
        "scope",
        "delegationDepth",
        "maxDelegationDepth",
        "spec_version",
        "principal"
      ],
      "properties": {
        "id": {
          "type": "string",
          "pattern": "^did:aria:[a-zA-Z0-9.-]+:[a-zA-Z0-9-]+$",
          "description": "The DID of the agent. Stable across reissuances. The unique per-issuance identifier lives at the top-level 'id' field per W3C VC 2.0."
        },
        "previousCredentialId": {
          "type": "string",
          "format": "uri",
          "pattern": "^https://api\\.aria\\.bar/v1/credentials/[0-9a-f]{8}-[0-9a-f]{4}-7[0-9a-f]{3}-[89ab][0-9a-f]{3}-[0-9a-f]{12}$",
          "description": "Optional. URL of the previous credential instance for this DID — set when this AID supersedes an earlier one. Enables chain-of-issuance traceability. Omitted on first issuance. The URL resolves to the predecessor's signed AID document (which by then is revoked in the StatusList)."
        },
        "agentName": {
          "type": "string",
          "minLength": 1,
          "maxLength": 64,
          "pattern": "^[a-zA-Z0-9][a-zA-Z0-9-]*[a-zA-Z0-9]$|^[a-zA-Z0-9]$",
          "description": "Human-readable agent name. 1-64 characters, alphanumeric and hyphens only. Must start and end with an alphanumeric character."
        },
        "version": {
          "type": "string",
          "pattern": "^(0|[1-9]\\d*)\\.(0|[1-9]\\d*)\\.(0|[1-9]\\d*)(?:-((?:0|[1-9]\\d*|\\d*[a-zA-Z-][0-9a-zA-Z-]*)(?:\\.(?:0|[1-9]\\d*|\\d*[a-zA-Z-][0-9a-zA-Z-]*))*))?(?:\\+([0-9a-zA-Z-]+(?:\\.[0-9a-zA-Z-]+)*))?$",
          "description": "Semantic version of the agent software."
        },
        "trustLevel": {
          "type": "string",
          "enum": ["L0", "L1", "L2", "L3"],
          "description": "Trust level assigned to the agent. L0=Anchored, L1=Identified, L2=Certified, L3=Sovereign."
        },
        "scope": {
          "type": "array",
          "items": {
            "type": "string",
            "pattern": "^[a-z][a-z0-9_]*:[a-z][a-z0-9_]*(:[a-z][a-z0-9_]*)*$",
            "description": "Scope in ARIA namespace format: namespace:resource:action."
          },
          "minItems": 1,
          "uniqueItems": true,
          "description": "Authorized scopes from the ARIA Scope Registry."
        },
        "hitlRequired": {
          "type": "array",
          "items": {
            "type": "string"
          },
          "uniqueItems": true,
          "description": "Scope identifiers that require human-in-the-loop approval before execution."
        },
        "delegationDepth": {
          "type": "integer",
          "minimum": 0,
          "maximum": 4,
          "description": "Current delegation depth. 0 means directly issued by the principal."
        },
        "maxDelegationDepth": {
          "type": "integer",
          "minimum": 0,
          "maximum": 4,
          "description": "Maximum allowed delegation depth for further sub-delegations."
        },
        "spec_version": {
          "type": "string",
          "const": "1.1",
          "description": "ARIA specification version. Must be '1.1' for this schema version."
        },
        "principal": {
          "type": "object",
          "required": ["did", "legalName", "jurisdiction", "verificationStatus"],
          "properties": {
            "did": {
              "type": "string",
              "description": "DID of the principal (legal entity or person) on whose behalf the agent operates."
            },
            "legalName": {
              "type": "string",
              "minLength": 1,
              "maxLength": 256,
              "description": "Legal name of the principal organization or person."
            },
            "jurisdiction": {
              "type": "string",
              "pattern": "^[A-Z]{2}$",
              "description": "ISO 3166-1 alpha-2 country code of the principal's legal jurisdiction."
            },
            "verificationStatus": {
              "type": "string",
              "enum": ["self-declared", "registry-confirmed", "legal-verified"],
              "description": "Machine-readable provenance of legalName. self-declared: registrant-asserted, no external check (L0, L1). registry-confirmed: cross-checked against an authoritative registry such as GLEIF LEI (L2). legal-verified: backed by government-issued legal documents and admin review (L3). Verifiers MUST consult this field before treating legalName as authoritative."
            }
          },
          "additionalProperties": false,
          "description": "The legal principal (organization or person) responsible for the agent."
        },
        "dnsAnchor": {
          "type": "string",
          "description": "DNS TXT record content anchoring this AID to the principal's domain. Format: v=ARIA1;id=<did>;h=sha256:<hash>;r=<resolution-url>."
        }
      },
      "additionalProperties": false,
      "description": "The subject of the credential — the AI agent and its attributes."
    },
    "proof": {
      "type": "object",
      "required": [
        "type",
        "cryptosuite",
        "created",
        "proofPurpose",
        "verificationMethod",
        "proofValue"
      ],
      "properties": {
        "type": {
          "type": "string",
          "const": "DataIntegrityProof",
          "description": "W3C Data Integrity proof type."
        },
        "cryptosuite": {
          "type": "string",
          "const": "mldsa65-ed25519-2026",
          "description": "Composite cryptographic suite: ML-DSA-65 (post-quantum, FIPS 204) + Ed25519 (classical)."
        },
        "created": {
          "type": "string",
          "format": "date-time",
          "description": "ISO 8601 datetime when the proof was created."
        },
        "proofPurpose": {
          "type": "string",
          "const": "assertionMethod",
          "description": "The purpose of the proof. Always 'assertionMethod' for AID issuance."
        },
        "verificationMethod": {
          "type": "string",
          "pattern": "^did:aria:.+#.+$",
          "description": "DID URL of the verification key used to create the proof."
        },
        "proofValue": {
          "type": "string",
          "description": "Base64url-encoded composite signature (ML-DSA-65 + Ed25519)."
        }
      },
      "additionalProperties": false,
      "description": "W3C Data Integrity proof containing the composite post-quantum + classical signature."
    }
  },
  "additionalProperties": false
}
